{
  "AlarmName": "example_value",
  "AlarmArn": "example_value",
  "AlarmDescription": "example_value",
  "AlarmConfigurationUpdatedTimestamp": "example_value",
  "ActionsEnabled": true,
  "OKActions": [],
  "AlarmActions": [],
  "InsufficientDataActions": [],
  "StateReason": "example_value",
  "StateReasonData": "example_value",
  "StateUpdatedTimestamp": "example_value",
  "MetricName": "example_value",
  "Namespace": "example_value",
  "ExtendedStatistic": "example_value",
  "Dimensions": [],
  "Period": 10,
  "EvaluationPeriods": 10,
  "DatapointsToAlarm": 10,
  "Threshold": 42.5,
  "TreatMissingData": "example_value",
  "EvaluateLowSampleCountPercentile": "example_value",
  "Metrics": [],
  "ThresholdMetricId": "500123",
  "StateTransitionedTimestamp": "example_value"
}